title,score,comments
How the legal opium market shaped global trade - and led to an opioid crisis,7,0
NSA Warned Everyone to Reboot Their Routers,36,24
China's Rare Defiance of US Sanctions Sparks Showdown over Banks,5,0
Utah to hold websites liable for users who mask their location with VPNs,223,263
Super ZSNES – GPU Powered SNES Emulator,337,116
The text mode lie: why modern TUIs are a nightmare for accessibility,13,2
Am I the only one who hates delivery robots?,65,73
A playable DOOM MCP app,91,31
Waymo in Portland,296,594
Laguna XS.2 and M.1,101,50
Apple accidentally left Claude.md files Apple Support app,382,320
The Super Nintendo Cartridges (2024),174,29
Men who stare at walls,719,336
AISLE Discovers 38 CVEs in OpenEMR Healthcare Software,177,113
"Facepunch launches s&box, the highly anticipated successor to Garry's Mod",24,6
US special forces soldier arrested after allegedly winning $400k on Maduro raid,691,751
"New 10 GbE USB adapters are cooler, smaller, cheaper",621,371
Getting my daily news from a dot matrix printer 2024,117,23
Show HN: I Built a Museum Exhibit,3,0
How many e's are in the word seventeen [video] (AI hallucination),6,7
When the cheap one is the cool one,171,117
Fully Featured Audio DSP Firmware for the Raspberry Pi Pico,328,92
Engineering tough blood clots for rapid haemostasis and enhanced regeneration,11,1
Investors pile into clean energy as Iran war drives push for energy security,126,179
Radar Laboratory – Interactive Radar Phenomenology,75,6
Understanding the LLM Bubble,8,6
Google and Pentagon reportedly agree on deal for 'any lawful' use of AI,316,282
Anomaly detection of private jet flights,25,2
Show HN: Clipmon is a macOS clipboard manager on steroids,5,6
Voice Modems,73,16
The Visible Zorker: Zork 1,149,38
Asahi Linux Progress Linux 7.0,657,363
Claude.ai unavailable and elevated errors on the API,297,252
Self-updating screenshots,488,75
Tell HN: An update from the new Tindie team,83,49
A beginner's guide to Sourcehut (2025),60,17
Hokusai and Tesselations,151,16
Functional programmers need to take a look at Zig,192,155
Training language models to be warm can reduce accuracy and increase sycophancy,4,0
"OSM-FR Panoramax server ""only for testing if outside of France""",4,0
GTFOBins,388,95
Most Companies Aren't Anywhere Near Ready for AI,6,3
The Rotary Un-Smartphone (2023),63,22
I won a championship that doesn't exist,232,128
"Dear friend, you have built a Kubernetes (2024)",143,174
Vercel’s pricing page,191,65
"Discret 11, the French TV encryption of the 80s (2020)",181,32
Show HN: TRiP – a complete transformer engine in C built from scratch just by me,38,6
Three men are facing charges in Toronto SMS Blaster arrests,201,126
Hackers are actively exploiting a bug in cPanel and WHM,40,7
Behavioral timescale synaptic plasticity rewires the brain after an experience,162,11
US Supreme Court reviews police use of cell location data,257,158
Apple CMF (Color-Matching Functions) 2026,90,9
Using the internet like it's 1999,256,190
Show HN: Utilyze – an open source GPU monitoring tool more accurate than nvtop,127,28
Notes on a non-profit indicted for bank fraud,42,8
